{
  "slug": "soulcap",
  "fictional": true,
  "disclaimer": "Illustrative story. People and data are fictional.",
  "personas": [
    {
      "id": "soulcap-zainab",
      "name": "Zainab Farooq",
      "age": 31,
      "city": "Lahore, Pakistan",
      "goal": "Breathing and a short journal before work",
      "headline": "How Zainab starts work without borrowing tomorrow’s worry",
      "summary": "Zainab teaches mornings. Phone for a physiological sigh, laptop for a longer journal on Fridays, tablet when she wants a calmer landscape view.",
      "day": [
        {
          "time": "06:50",
          "title": "Breath first",
          "text": "Before email, Zainab runs a physiological sigh on her iPhone — two minutes in the dark hallway outside the classroom, feet on the floor, then the day can start.",
          "shot": "zainab/01-iphone",
          "device": "iphone",
          "alt": "Breathing on iPhone"
        },
        {
          "time": "07:05",
          "title": "Feeling check",
          "text": "Same phone: she taps how she feels without writing an essay — a check-in that takes less time than scrolling the news.",
          "shot": "zainab/02-iphone",
          "device": "iphone",
          "alt": "Check-in on phone"
        },
        {
          "time": "12:30",
          "title": "Tablet calm",
          "text": "At lunch the shared iPad opens Calm tools; landscape view, no autoplay noise, just a reset before afternoon classes.",
          "shot": "zainab/03-ipad",
          "device": "ipad",
          "alt": "Calm on tablet"
        },
        {
          "time": "21:00",
          "title": "Friday laptop journal",
          "text": "Friday night she writes a longer journal on the laptop — still private, still on-device — naming the week without turning it into content.",
          "shot": "zainab/04-mac",
          "device": "mac",
          "alt": "Journal on laptop"
        },
        {
          "time": "21:40",
          "title": "Close kindly",
          "text": "Phone shows crisis info is reachable if she ever needs it. Tonight she does not. She locks the screen kindly.",
          "shot": "zainab/05-iphone",
          "device": "iphone",
          "alt": "Help nearby on phone"
        }
      ],
      "before": [
        {
          "label": "Spirals before class",
          "value": "Most mornings"
        },
        {
          "label": "Wrote anything down",
          "value": "Rarely"
        }
      ],
      "after": [
        {
          "label": "Breath before class",
          "value": "Habit"
        },
        {
          "label": "Friday journal",
          "value": "On device"
        }
      ],
      "video": {
        "mp4": "zainab/story.mp4",
        "webm": "zainab/story.webm",
        "vtt": "zainab/story.vtt",
        "poster": "zainab/poster.jpg",
        "transcript": "Zainab breathes and checks in on phone, uses Calm on tablet, journals on laptop. Crisis copy unchanged. Fictional."
      },
      "features_used": [
        "guided-techniques",
        "on-device-journal",
        "one-tap-check-in"
      ],
      "quote": "Two minutes. Then the day can start.",
      "fictional": true,
      "needs": [
        "health"
      ]
    },
    {
      "id": "soulcap-tom",
      "name": "Tom Weber",
      "age": 44,
      "city": "Berlin, Germany",
      "goal": "An evening wind-down he can keep after late meetings",
      "headline": "How Tom ends loud days quietly",
      "summary": "Tom consults across time zones. Phone for a short wind-down on the U-Bahn, laptop for evening reflection, tablet on the sofa.",
      "day": [
        {
          "time": "19:10",
          "title": "Commute breath",
          "text": "On the U-Bahn Tom runs a short physiological sigh on his phone between stations — meetings still echoing, scroll hole deferred.",
          "shot": "tom/01-iphone",
          "device": "iphone",
          "alt": "Breath on commute"
        },
        {
          "time": "21:00",
          "title": "Sofa tablet",
          "text": "On the sofa the iPad opens Calm tools without autoplay noise; he picks one reset and leaves the rest alone.",
          "shot": "tom/02-ipad",
          "device": "ipad",
          "alt": "Calm on iPad"
        },
        {
          "time": "22:15",
          "title": "Laptop reflection",
          "text": "Three lines of reflection on the laptop, then the lid closes. The day is allowed to stop.",
          "shot": "tom/03-mac",
          "device": "mac",
          "alt": "Reflection on laptop"
        },
        {
          "time": "22:45",
          "title": "Phone away",
          "text": "Last phone check confirms help is listed, then Do Not Disturb. Berlin can wait until morning.",
          "shot": "tom/04-iphone",
          "device": "iphone",
          "alt": "Phone wind-down"
        }
      ],
      "before": [
        {
          "label": "Doomscroll after work",
          "value": "45 min"
        },
        {
          "label": "Sleep onset",
          "value": "Late"
        }
      ],
      "after": [
        {
          "label": "Wind-down",
          "value": "10 min"
        },
        {
          "label": "Screens down",
          "value": "Earlier"
        }
      ],
      "video": {
        "mp4": "tom/story.mp4",
        "webm": "tom/story.webm",
        "vtt": "tom/story.vtt",
        "poster": "tom/poster.jpg",
        "transcript": "Tom winds down across phone, iPad, and laptop. Fictional Berlin evening."
      },
      "features_used": [
        "guided-techniques",
        "on-device-journal",
        "help-numbers"
      ],
      "quote": "The day can stop without a scroll hole.",
      "fictional": true,
      "needs": [
        "health"
      ]
    },
    {
      "id": "soulcap-amina",
      "name": "Amina Otieno",
      "age": 19,
      "city": "Nairobi, Kenya",
      "goal": "Grounding before exams — with crisis info exactly as locked",
      "headline": "How Amina grounds before exams",
      "summary": "Amina is a first-year student. Phone for grounding before papers, laptop in the library for journaling, shared tablet at home.",
      "day": [
        {
          "time": "08:00",
          "title": "Grounding",
          "text": "Outside the exam hall Amina grounds on her phone — five things she can see, feet on the concrete — until her pulse is boring again.",
          "shot": "amina/01-iphone",
          "device": "iphone",
          "alt": "Grounding on phone"
        },
        {
          "time": "14:00",
          "title": "Library laptop",
          "text": "Between papers she opens a quiet journal on the library laptop; no performance, just what her hands are doing.",
          "shot": "amina/02-mac",
          "device": "mac",
          "alt": "Journal on laptop"
        },
        {
          "time": "18:30",
          "title": "Home tablet",
          "text": "At home the shared iPad gets a short Calm reset while her sister revises across the table.",
          "shot": "amina/03-ipad",
          "device": "ipad",
          "alt": "Calm on tablet"
        },
        {
          "time": "21:00",
          "title": "Help is there",
          "text": "Phone shows locked crisis info exactly as shipped. She reads it once, calmly, and puts the phone away.",
          "shot": "amina/04-iphone",
          "device": "iphone",
          "alt": "Crisis info as locked"
        }
      ],
      "before": [
        {
          "label": "Exam panic peaks",
          "value": "Weekly"
        },
        {
          "label": "Knew helplines existed",
          "value": "Vague"
        }
      ],
      "after": [
        {
          "label": "Grounding used",
          "value": "Before papers"
        },
        {
          "label": "Helplines visible",
          "value": "As shipped"
        }
      ],
      "video": {
        "mp4": "amina/story.mp4",
        "webm": "amina/story.webm",
        "vtt": "amina/story.vtt",
        "poster": "amina/poster.jpg",
        "transcript": "Amina grounds on phone, journals on laptop, resets on tablet. Crisis copy exact. Fictional."
      },
      "features_used": [
        "guided-techniques",
        "on-device-journal",
        "help-numbers"
      ],
      "quote": "I can feel my feet again.",
      "fictional": true,
      "needs": [
        "health"
      ]
    }
  ]
}
