{
  "slug": "ideacap",
  "fictional": true,
  "disclaimer": "Fictional people and story. Screenshots and video are from the real app, with sample data labeled for this persona — not a live customer account.",
  "personas": [
    {
      "id": "ideacap-zara",
      "name": "Zara Malik",
      "age": 32,
      "city": "Lahore, Pakistan",
      "goal": "Voice ideas while commuting",
      "headline": "How Zara catches ideas before they vanish",
      "summary": "Zara records on phone in the rickshaw, tags on iPad at the studio, reviews on laptop.",
      "day": [
        {
          "time": "08:40",
          "title": "Voice capture",
          "text": "In the rickshaw Zara hits voice capture on her phone — if she can say it before the idea vanishes, it is saved on-device.",
          "shot": "zara/01-iphone",
          "device": "iphone",
          "alt": "Voice capture"
        },
        {
          "time": "11:00",
          "title": "Tag on iPad",
          "text": "Studio iPad tags the morning captures by project so they do not drown in a single undated inbox.",
          "shot": "zara/02-ipad",
          "device": "ipad",
          "alt": "Tags"
        },
        {
          "time": "18:00",
          "title": "Laptop review",
          "text": "Laptop idea list at end of day; she promotes one seed and parks the rest without guilt.",
          "shot": "zara/03-mac",
          "device": "mac",
          "alt": "Ideas"
        },
        {
          "time": "19:00",
          "title": "Note detail",
          "text": "Note detail on the laptop expands the keeper into something she can pitch tomorrow.",
          "shot": "zara/04-mac",
          "device": "mac",
          "alt": "Detail"
        },
        {
          "time": "19:30",
          "title": "Phone",
          "text": "Phone inbox feels lighter. Saying it was enough to keep it.",
          "shot": "zara/05-iphone",
          "device": "iphone",
          "alt": "Inbox"
        }
      ],
      "before": [
        {
          "label": "Lost ideas",
          "value": "Daily"
        },
        {
          "label": "Notes app mess",
          "value": "Bad"
        }
      ],
      "after": [
        {
          "label": "Captured",
          "value": "On device"
        },
        {
          "label": "Tagged",
          "value": "By project"
        }
      ],
      "video": {
        "mp4": "zara/story.mp4",
        "webm": "zara/story.webm",
        "vtt": "zara/story.vtt",
        "poster": "zara/poster.jpg",
        "transcript": "Zara captures on phone, tags on iPad, reviews on laptop. Fictional."
      },
      "features_used": [
        "voice-text-capture",
        "ideas-board"
      ],
      "quote": "If I can say it, it is saved.",
      "fictional": true,
      "needs": [
        "learning"
      ]
    },
    {
      "id": "ideacap-kevin",
      "name": "Kevin Ortiz",
      "age": 45,
      "city": "Toronto, Canada",
      "goal": "Product ideas tagged by project",
      "headline": "How Kevin keeps product ideas from drowning in Slack",
      "summary": "Kevin dumps ideas on phone, sorts on iPad, decisions on laptop.",
      "day": [
        {
          "time": "07:30",
          "title": "Quick capture",
          "text": "Kevin dumps a product idea on his phone before standup — Slack is not his notebook, and he is done pretending it is.",
          "shot": "kevin/01-iphone",
          "device": "iphone",
          "alt": "Capture"
        },
        {
          "time": "13:00",
          "title": "iPad sort",
          "text": "iPad sort by project at lunch; tags beat scrolling a year of threads for “that one thought.”",
          "shot": "kevin/02-ipad",
          "device": "ipad",
          "alt": "Sort"
        },
        {
          "time": "21:00",
          "title": "Laptop decide",
          "text": "Laptop note detail becomes a decision log — ship, park, or ask — instead of eternal emoji reactions.",
          "shot": "kevin/03-mac",
          "device": "mac",
          "alt": "Decide"
        },
        {
          "time": "21:40",
          "title": "Settings",
          "text": "Settings confirm offline-friendly habits; the ideas stay his even when the VPN sulks.",
          "shot": "kevin/04-mac",
          "device": "mac",
          "alt": "Settings"
        },
        {
          "time": "22:00",
          "title": "Phone",
          "text": "Phone clears. Ideas live in IdeaCap, not in a channel he will never search.",
          "shot": "kevin/05-iphone",
          "device": "iphone",
          "alt": "Clear"
        }
      ],
      "before": [
        {
          "label": "Ideas in Slack",
          "value": "Lost"
        },
        {
          "label": "Decision log",
          "value": "None"
        }
      ],
      "after": [
        {
          "label": "Ideas in IdeaCap",
          "value": "Tagged"
        },
        {
          "label": "Decisions",
          "value": "Notes"
        }
      ],
      "video": {
        "mp4": "kevin/story.mp4",
        "webm": "kevin/story.webm",
        "vtt": "kevin/story.vtt",
        "poster": "kevin/poster.jpg",
        "transcript": "Kevin captures on phone, sorts on iPad, decides on laptop. Fictional."
      },
      "features_used": [
        "ideas-board",
        "summary-local"
      ],
      "quote": "Slack is not my notebook.",
      "fictional": true,
      "needs": [
        "learning"
      ]
    },
    {
      "id": "ideacap-hamid",
      "name": "Hamid Siddiqui",
      "age": 60,
      "city": "Karachi, Pakistan",
      "goal": "Story ideas, offline only",
      "headline": "How Hamid keeps story seeds offline",
      "summary": "Hamid writes on phone in the garden, expands on iPad, manuscripts on laptop — no account wall.",
      "day": [
        {
          "time": "07:00",
          "title": "Garden phone",
          "text": "Garden morning: Hamid writes a story seed on his phone — offline is the point, no account wall between him and the line.",
          "shot": "hamid/01-iphone",
          "device": "iphone",
          "alt": "Seed"
        },
        {
          "time": "11:00",
          "title": "iPad expand",
          "text": "iPad expand turns the seed into a scene without uploading anything to a stranger’s cloud.",
          "shot": "hamid/02-ipad",
          "device": "ipad",
          "alt": "Expand"
        },
        {
          "time": "17:00",
          "title": "Laptop draft",
          "text": "Laptop draft gathers the day’s seeds into something that might become a chapter.",
          "shot": "hamid/03-mac",
          "device": "mac",
          "alt": "Draft"
        },
        {
          "time": "18:00",
          "title": "Laptop list",
          "text": "Ideas list on the laptop stays local; he owns the folder the way he owns the notebooks.",
          "shot": "hamid/04-mac",
          "device": "mac",
          "alt": "List"
        },
        {
          "time": "18:30",
          "title": "Phone",
          "text": "Phone locks. Offline won. The seed is still there.",
          "shot": "hamid/05-iphone",
          "device": "iphone",
          "alt": "Lock"
        }
      ],
      "before": [
        {
          "label": "Ideas on paper scraps",
          "value": "Lost"
        },
        {
          "label": "Needed an account",
          "value": "Elsewhere"
        }
      ],
      "after": [
        {
          "label": "Seeds saved",
          "value": "On device"
        },
        {
          "label": "Accounts",
          "value": "None"
        }
      ],
      "video": {
        "mp4": "hamid/story.mp4",
        "webm": "hamid/story.webm",
        "vtt": "hamid/story.vtt",
        "poster": "hamid/poster.jpg",
        "transcript": "Hamid works fully offline across phone, iPad, laptop. Fictional."
      },
      "features_used": [
        "ideas-board",
        "optional-keys"
      ],
      "quote": "Offline is the point.",
      "fictional": true,
      "needs": [
        "learning"
      ]
    }
  ]
}
