{
  "slug": "travelcap",
  "fictional": true,
  "disclaimer": "Illustrative story. People and data are fictional.",
  "personas": [
    {
      "id": "travelcap-sana",
      "name": "Sana & Kamran",
      "age": 29,
      "city": "Karachi → Istanbul",
      "goal": "Honeymoon tickets, hotel, docs",
      "headline": "How Sana kept the honeymoon docs in one trip",
      "summary": "Phone for boarding passes, iPad for the itinerary on the sofa, laptop for documents before departure.",
      "day": [
        {
          "time": "09:00",
          "title": "Trip home",
          "text": "Sana opens the honeymoon trip on her phone — tickets, hotel, the shape of Istanbul — without diving into WhatsApp archaeology.",
          "shot": "sana/01-iphone",
          "device": "iphone",
          "alt": "Trip on phone"
        },
        {
          "time": "11:00",
          "title": "Flights",
          "text": "Flight details on the phone are readable at the gate; Kamran can glance without hunting a forwarded PDF.",
          "shot": "sana/02-iphone",
          "device": "iphone",
          "alt": "Flights"
        },
        {
          "time": "16:00",
          "title": "iPad itinerary",
          "text": "Sofa iPad itinerary for the day plan; they argue about museums, not about which chat has the booking.",
          "shot": "sana/03-ipad",
          "device": "ipad",
          "alt": "Itinerary"
        },
        {
          "time": "20:00",
          "title": "Docs laptop",
          "text": "Laptop document list before departure — passports, visas, confirmations — one trip, one checklist.",
          "shot": "sana/04-mac",
          "device": "mac",
          "alt": "Documents"
        },
        {
          "time": "21:00",
          "title": "Budget",
          "text": "Budget on the laptop is illustrative; they set a calm ceiling and close the lid excited, not panicked.",
          "shot": "sana/05-mac",
          "device": "mac",
          "alt": "Budget"
        }
      ],
      "before": [
        {
          "label": "Docs across chats",
          "value": "Dozens"
        },
        {
          "label": "Day-of panic",
          "value": "High"
        }
      ],
      "after": [
        {
          "label": "Docs in trip",
          "value": "One place"
        },
        {
          "label": "Day-of",
          "value": "Calm"
        }
      ],
      "video": {
        "mp4": "sana/story.mp4",
        "webm": "sana/story.webm",
        "vtt": "sana/story.vtt",
        "poster": "sana/poster.jpg",
        "transcript": "Sana runs the honeymoon trip across phone, iPad, laptop. Fictional."
      },
      "features_used": [
        "trip-dashboard",
        "document-vault",
        "transit-stays"
      ],
      "quote": "One trip. No WhatsApp archaeology.",
      "fictional": true,
      "needs": [
        "travel",
        "family"
      ]
    },
    {
      "id": "travelcap-hassan",
      "name": "Hassan Qureshi",
      "age": 39,
      "city": "Dubai, UAE",
      "goal": "Monthly business trips and visas",
      "headline": "How Hassan stopped re-finding the same visa PDF",
      "summary": "Hassan opens trips on phone in rides, iPad in lounges, laptop at the hotel desk.",
      "day": [
        {
          "time": "06:00",
          "title": "Airport phone",
          "text": "In the ride to the airport Hassan opens the trip on his phone — visa pinned with the itinerary, not lost in email.",
          "shot": "hassan/01-iphone",
          "device": "iphone",
          "alt": "Trip"
        },
        {
          "time": "09:00",
          "title": "Lounge iPad",
          "text": "Lounge iPad shows documents without digging through folders named “final_final_visa.”",
          "shot": "hassan/02-ipad",
          "device": "ipad",
          "alt": "Docs"
        },
        {
          "time": "21:00",
          "title": "Hotel laptop",
          "text": "Hotel desk laptop drafts the next trip while this one is still warm; continuity instead of starting from zero.",
          "shot": "hassan/03-mac",
          "device": "mac",
          "alt": "Next trip"
        },
        {
          "time": "21:40",
          "title": "Expenses",
          "text": "Expenses on the laptop are illustrative — enough to reclaim the month without a shoebox of receipts.",
          "shot": "hassan/04-mac",
          "device": "mac",
          "alt": "Expenses"
        },
        {
          "time": "22:00",
          "title": "Phone",
          "text": "Phone tomorrow view. The visa lives with the trip. He sleeps.",
          "shot": "hassan/05-iphone",
          "device": "iphone",
          "alt": "Tomorrow"
        }
      ],
      "before": [
        {
          "label": "Visa PDF hunts",
          "value": "Every trip"
        },
        {
          "label": "Lounge chaos",
          "value": "High"
        }
      ],
      "after": [
        {
          "label": "Visa with trip",
          "value": "Pinned"
        },
        {
          "label": "Lounge",
          "value": "Clear"
        }
      ],
      "video": {
        "mp4": "hassan/story.mp4",
        "webm": "hassan/story.webm",
        "vtt": "hassan/story.vtt",
        "poster": "hassan/poster.jpg",
        "transcript": "Hassan uses phone, iPad, laptop across a business hop. Fictional."
      },
      "features_used": [
        "trip-dashboard",
        "document-vault",
        "official-sources"
      ],
      "quote": "The visa lives with the trip.",
      "fictional": true,
      "needs": [
        "travel",
        "money"
      ]
    },
    {
      "id": "travelcap-malik",
      "name": "The Malik family",
      "age": 42,
      "city": "London → Lahore",
      "goal": "Umrah + family visit, kids’ passports",
      "headline": "How the Maliks kept five passports visible",
      "summary": "Phone for day-of, iPad for kids’ list, laptop for the full document pack.",
      "day": [
        {
          "time": "08:00",
          "title": "Family trip",
          "text": "Family trip overview on the phone — London to Lahore, Umrah plus visits — five people, one dashboard.",
          "shot": "malik/01-iphone",
          "device": "iphone",
          "alt": "Trip"
        },
        {
          "time": "10:00",
          "title": "Kids on iPad",
          "text": "iPad checklist with the kids pointing at passport rows; scramble becomes a game with a finish line.",
          "shot": "malik/02-ipad",
          "device": "ipad",
          "alt": "Checklist"
        },
        {
          "time": "19:00",
          "title": "Laptop pack",
          "text": "Laptop full document pack before packing night; nothing lives only in a parent’s head.",
          "shot": "malik/03-mac",
          "device": "mac",
          "alt": "Docs"
        },
        {
          "time": "20:00",
          "title": "Flights",
          "text": "Flights on the laptop for the whole party; seats and times visible without five separate screenshots.",
          "shot": "malik/04-mac",
          "device": "mac",
          "alt": "Flights"
        },
        {
          "time": "21:00",
          "title": "Phone",
          "text": "Phone day-of view at the door. Five passports. One checklist. Calm enough to joke.",
          "shot": "malik/05-iphone",
          "device": "iphone",
          "alt": "Day-of"
        }
      ],
      "before": [
        {
          "label": "Passport scramble",
          "value": "Every departure"
        },
        {
          "label": "Kids’ docs",
          "value": "Scattered"
        }
      ],
      "after": [
        {
          "label": "Checklist",
          "value": "Complete"
        },
        {
          "label": "Kids’ docs",
          "value": "In trip"
        }
      ],
      "video": {
        "mp4": "malik/story.mp4",
        "webm": "malik/story.webm",
        "vtt": "malik/story.vtt",
        "poster": "malik/poster.jpg",
        "transcript": "The Maliks coordinate across phone, iPad, laptop. Fictional."
      },
      "features_used": [
        "trip-dashboard",
        "document-vault",
        "transit-stays"
      ],
      "quote": "Five passports. One checklist.",
      "fictional": true,
      "needs": [
        "travel",
        "family"
      ]
    }
  ]
}
