{
  "slug": "vaultcap",
  "fictional": true,
  "disclaimer": "Fictional people and story. Screenshots and video are from the real app, with sample data labeled for this persona — not a live customer account.",
  "personas": [
    {
      "id": "vaultcap-ayesha",
      "name": "Ayesha Siddiqui",
      "age": 41,
      "city": "Lahore, Pakistan",
      "goal": "Family documents and expiries in one encrypted vault",
      "headline": "How Ayesha stopped digging through drawers",
      "summary": "Ayesha runs a pharmacy and two school runs in Lahore. She finds documents on her phone between customers, reviews family profiles on the kitchen iPad, and does banks plus Zakat on the laptop — always on-device, always fictional sample data.",
      "day": [
        {
          "time": "07:40",
          "title": "Morning vault",
          "text": "Pharmacy keys in one hand, Ayesha opens VaultCap on her iPhone — three expiries this month, including a school passport she would have found in a drawer too late.",
          "shot": "ayesha/01-iphone",
          "device": "iphone",
          "alt": "Vault home on iPhone"
        },
        {
          "time": "12:15",
          "title": "Documents find",
          "text": "Between customers a phone search finds the passport scan in seconds; she texts the school office without leaving the counter or digging through WhatsApp.",
          "shot": "ayesha/02-iphone",
          "device": "iphone",
          "alt": "Documents on phone"
        },
        {
          "time": "18:30",
          "title": "Family on iPad",
          "text": "Kitchen iPad after school runs: husband’s profile separate, kids’ docs labeled, everything still on-device — no family Dropbox argument.",
          "shot": "ayesha/03-ipad",
          "device": "ipad",
          "alt": "Family profiles on iPad"
        },
        {
          "time": "20:10",
          "title": "Banks glance",
          "text": "Laptop for a calm look at sample bank accounts before Ramadan planning; numbers illustrative, tone quiet, no tipping or advice.",
          "shot": "ayesha/04-mac",
          "device": "mac",
          "alt": "Banks on laptop"
        },
        {
          "time": "21:00",
          "title": "Zakat summary",
          "text": "Same laptop shows a Zakat summary from holdings so she can email the accountant without photographing paper ledgers.",
          "shot": "ayesha/05-mac",
          "device": "mac",
          "alt": "Zakat on laptop"
        },
        {
          "time": "21:40",
          "title": "Reminders set",
          "text": "Phone locks with renewal reminders confirmed. Drawers stay drawers. The vault stays the vault.",
          "shot": "ayesha/06-iphone",
          "device": "iphone",
          "alt": "Reminders on phone"
        }
      ],
      "before": [
        {
          "label": "Time to find a passport",
          "value": "20 min"
        },
        {
          "label": "Places documents lived",
          "value": "3 drawers + chats"
        }
      ],
      "after": [
        {
          "label": "Time to find a passport",
          "value": "1 min"
        },
        {
          "label": "Expiry surprises",
          "value": "0 missed"
        }
      ],
      "video": {
        "mp4": "ayesha/story.mp4",
        "webm": "ayesha/story.webm",
        "vtt": "ayesha/story.vtt",
        "poster": "ayesha/poster.jpg",
        "transcript": "Morning vault on iPhone shows expiries. Midday search finds a passport scan. Evening iPad separates family profiles. Laptop banks and Zakat stay calm and illustrative. Phone reminders lock the day. Fictional sample vault throughout."
      },
      "features_used": [
        "family-profiles",
        "expiry-reminders",
        "zakat",
        "documents"
      ],
      "quote": "I stopped digging through drawers.",
      "fictional": true,
      "needs": [
        "family",
        "money"
      ]
    },
    {
      "id": "vaultcap-omar",
      "name": "Omar Rahman",
      "age": 29,
      "city": "Dubai, UAE",
      "goal": "Multi-currency accounts and a backup before a phone change",
      "headline": "How Omar backed up before swapping phones",
      "summary": "Omar freelances across currencies. Phone for day balances, laptop for encrypted export, iPad when reviewing cards on the sofa.",
      "day": [
        {
          "time": "09:00",
          "title": "Currency glance",
          "text": "Omar’s phone dashboard shows AED and GBP sample balances before the first client call — multi-currency without opening three banking apps.",
          "shot": "omar/01-iphone",
          "device": "iphone",
          "alt": "Dashboard on phone"
        },
        {
          "time": "11:30",
          "title": "Cards check",
          "text": "On the sofa he reviews cards on the iPad before lunch, expiry dates visible, no glovebox archaeology.",
          "shot": "omar/02-ipad",
          "device": "ipad",
          "alt": "Cards on iPad"
        },
        {
          "time": "16:00",
          "title": "Export on laptop",
          "text": "Laptop writes an encrypted .vos backup to a disk he owns — new phone week, no cloud rent, no “upload everything” pitch.",
          "shot": "omar/03-mac",
          "device": "mac",
          "alt": "Backup on laptop"
        },
        {
          "time": "19:20",
          "title": "Security review",
          "text": "Security settings on the laptop get a once-over before the swap: demo labeled, passphrase habits intact.",
          "shot": "omar/04-mac",
          "device": "mac",
          "alt": "Security on laptop"
        },
        {
          "time": "21:00",
          "title": "Phone ready",
          "text": "New phone restores from the backup; the sample vault opens like nothing moved. He smiles at the boring success.",
          "shot": "omar/05-iphone",
          "device": "iphone",
          "alt": "Restored vault on phone"
        }
      ],
      "before": [
        {
          "label": "Fear of losing vault on swap",
          "value": "High"
        },
        {
          "label": "Backup age",
          "value": "Unknown"
        }
      ],
      "after": [
        {
          "label": "Encrypted export",
          "value": "Done"
        },
        {
          "label": "Restore tested",
          "value": "On device"
        }
      ],
      "video": {
        "mp4": "omar/story.mp4",
        "webm": "omar/story.webm",
        "vtt": "omar/story.vtt",
        "poster": "omar/poster.jpg",
        "transcript": "Omar reviews money on phone and iPad, exports on laptop, restores on a new phone. Fictional."
      },
      "features_used": [
        "encrypted-backup",
        "aes-gcm-vault",
        "documents"
      ],
      "quote": "New phone. Same vault. No cloud rent.",
      "fictional": true,
      "needs": [
        "money"
      ]
    },
    {
      "id": "vaultcap-margaret",
      "name": "Margaret Ellis",
      "age": 68,
      "city": "Manchester, UK",
      "goal": "Pension and insurance papers her son can help with — large text",
      "headline": "How Margaret keeps pension papers readable",
      "summary": "Margaret uses larger text on iPhone, reviews documents on iPad with her son, and keeps settings clear on the laptop in the study.",
      "day": [
        {
          "time": "10:00",
          "title": "Large-text home",
          "text": "Margaret’s iPhone home uses larger text so renewals are readable without asking her son to “just read this bit.”",
          "shot": "margaret/01-iphone",
          "device": "iphone",
          "alt": "Large text home"
        },
        {
          "time": "14:20",
          "title": "Documents",
          "text": "Documents list on the same phone holds pension letters she used to lose in the bureau — titles clear, not tiny scan thumbnails.",
          "shot": "margaret/02-iphone",
          "device": "iphone",
          "alt": "Documents large text"
        },
        {
          "time": "16:00",
          "title": "Son on iPad",
          "text": "iPad on the table while her son helps label files; he can help without taking the papers away in a plastic bag.",
          "shot": "margaret/03-ipad",
          "device": "ipad",
          "alt": "Documents on iPad"
        },
        {
          "time": "19:00",
          "title": "Reminders",
          "text": "Laptop reminders for home insurance sit in the study beside the kettle — dates she can actually see.",
          "shot": "margaret/04-mac",
          "device": "mac",
          "alt": "Reminders on laptop"
        },
        {
          "time": "19:40",
          "title": "Settings check",
          "text": "Settings on the laptop stay honest: demo labelled, text size kept. She closes the lid feeling organised, not managed.",
          "shot": "margaret/05-mac",
          "device": "mac",
          "alt": "Settings on laptop"
        }
      ],
      "before": [
        {
          "label": "Time to find a policy",
          "value": "25 min"
        },
        {
          "label": "Could read small print",
          "value": "Often no"
        }
      ],
      "after": [
        {
          "label": "Time to find a policy",
          "value": "2 min"
        },
        {
          "label": "Text size",
          "value": "Comfortable"
        }
      ],
      "video": {
        "mp4": "margaret/story.mp4",
        "webm": "margaret/story.webm",
        "vtt": "margaret/story.vtt",
        "poster": "margaret/poster.jpg",
        "transcript": "Margaret uses large text on iPhone, reviews with her son on iPad, settings on laptop. Fictional."
      },
      "features_used": [
        "expiry-reminders",
        "documents",
        "dynamic-type"
      ],
      "quote": "He can help without taking the papers away.",
      "fictional": true,
      "needs": [
        "family",
        "money"
      ]
    }
  ]
}
